[{
  "name":"test",
  "imageFrame":{"x":0.5 ,"y":0.1,"width":0.3,"height":0.85, "columns": 1,"rows": 1},
  "subImageCoordinates":[
    {
      "x": 0,
      "y": 0,
      "width": 1,
      "height": 1,
      "columns": 1,
      "rows": 1
    }
  ],
  "autoScale":"fill",
  "verticalAlign":"middle",
  "horizontalAlign":"center",
  "clippingEnabled": false
}]